### ISSUE TITLE
[Bug]: Can't connect after restarting docker container

### ISSUE THREAD

**Issue by EvanBelcher** [wg-easy/wg-easy#2208]
### Describe the bug

Steps to reproduce:
1. Deploy a brand new wg-easy container following the normal docker compose install instructions.
2. Change any necessary settings, connect a client, and verify you can connect via the VPN. This works for me.
3. Run `docker compose restart` (`docker compose down` followed by `docker compose up -d` behaves the same)
4. Confirm that the connection no longer works on the client

After the container restart, the handshake still works and according to the ui it seems a small amount of data is being exchanged with the client, but I can no longer connect.

This is my current compose file:
```
      volumes:
        etc_wireguard:
      
      services:
        wg-easy:
          environment:
          #  Optional:
          #  - PORT=51821
          #  - HOST=0.0.0.0
           - INSECURE=true
      
          image: ghcr.io/wg-easy/wg-easy:15
          container_name: wg-easy
          networks:
            wg:
              ipv4_address: 10.42.42.42
              ipv6_address: fdcc:ad94:bacf:61a3::2a
          volumes:
            - etc_wireguard:/etc/wireguard
            - /lib/modules:/lib/modules:ro
          ports:
            - "51820:51820/udp"
            - "51821:51821/tcp"
          labels:
            - flame.type=app
            - flame.name=Wireguard
            - flame.url=<external url>
            - flame.icon=router-wireless # optional, default is "docker" https://pictogrammers.com/library/mdi/
          restart: always
          cap_add:
            - NET_ADMIN
            - SYS_MODULE
            # - NET_RAW # ⚠️ Uncomment if using Podman
          sysctls:
            - net.ipv4.ip_forward=1
            - net.ipv4.conf.all.src_valid_mark=1
            - net.ipv6.conf.all.disable_ipv6=0
            - net.ipv6.conf.all.forwarding=1
            - net.ipv6.conf.default.forwarding=1
      
      networks:
        wg:
          driver: bridge
          enable_ipv6: true
          #driver_opts:
          #  com.docker.network.driver.mtu: 1420
          ipam:
            driver: default
            config:
              - subnet: 10.42.42.0/24
              - subnet: fdcc:ad94:bacf:61a3::/64
```

### Expected behavior

Restarting the docker container restores connectivity with the clients

**Comment by melon-ruet** [comment]
I am facing the same issue

**Comment by Cpasjuste** [comment]
Hi,

Fighting with the same issue :)

To add some more background, I use wg-easy 15.1 with docker version 28.5.1, build e180ab8 on Ubuntu 24.04. 

When I "start from scratch", and change the settings in the UI (I use udp port 8080) and add a client, it work fine. If I restart the server or docker, then the clients can connect and receive keep alive packets but that's all. 

**If I delete the volume and so restart from scratch, it works again**.

@EvanBelcher, did you find a solution? I tried a lot of things with no luck.

**Comment by EvanBelcher** [comment]
I ended up doing the same as you, just deleted the volume so I could restart from scratch. Relieved slightly that I'm not alone in this issue.

**Comment by Cpasjuste** [comment]
I need to do some more testing but I think my problem may be related to having two networks (wg and traefik). I saw that interfaces are randomly "switched" at startup (wg is eth0, traefik one eth1 then the opposite).

I removed the traefik one and it seems to work, but I didn't had the time to truly test if all is working on multiple restart.

The thing is you seems to not have multiple networks... So it's maybe not related.

**Comment by Cpasjuste** [comment]
So it seems removing my second network does make wg-easy works after a restart and such. 

Also, if a second network is required traefik, etc...) it seems we can fix it by specifying network interface name in docker compose so wg network interface is always eth0:

```
networks:
      wg:
        interface_name: eth0
        ipv4_address: 10.42.42.42
      traefik_default:
        interface_name: eth1
```

**Comment by bohleadam** [comment]
I'm seeing a similar issue. I did start a Traefik container this morning with the plan of routing traffic to the 51821 administration portal through Traefik. I set Traefik to not expose everything by default and I didn't set any Traefik labels on the wg-easy compose file.

But since doing this, wg-easy is not happy. I have deleted the Traefik network I created, I have removed wg-easy image and container, deleted the wg-easy network, deleted the volume as @Cpasjuste did and reconfigured everything from scratch. But things are still not happy. I am able to create configs and my clients believe they are connected. However, I don't see an "active" connection next to my clients in the admin portal.

On the host running the container I can get to the networks I want to reach and if I exec into the g-easy container I can ping everywhere I want to get to. Not sure what else to try

**Comment by Cpasjuste** [comment]
I did finally fix "my" (our?) problem with using wg-easy with two networks (wg-easy + traefik). Specifying interfaces names do fix the "interface swapping" problem at container start. 

But this was not enough as the default gateway interface of the container was set to the traefik network, and so docker was forwarding the wireguard server port to the traefik network instead wg-easy one. So we have to specify a [gateway priority](https://docs.docker.com/reference/compose-file/services/#gw_priority) for the port forwarding to happen on the right network. Here is the final network configuration which seems to works fine after docker/server restart:

```
    networks:
      wg:
        interface_name: eth0
        gw_priority: 1
        ipv4_address: 10.42.42.42
      traefik_default:
        interface_name: eth1
        gw_priority: 0
```

We also need to **specify traefik network** in the labels of the compose file, else it will be randomly chosen (and randomly fail to create the traefik service):
```
labels:
      - "traefik.enable=true"
      - "traefik.docker.network=traefik_default"
      - "traefik.http.services.wg-easy.loadbalancer.server.port=51821"
      - "traefik.docker.network=my_traefik_network_name"
      - ...
```

We can verify if the wireguard interface is indeed `eth0` (**interface_name**):
```
sudo docker exec -it $(sudo docker ps -aqf "name=wg-easy") sh -c "ip addr"
```
```
1: lo: <LOOPBACK,UP,LOWER_UP> mtu 65536 qdisc noqueue state UNKNOWN group default qlen 1000
    link/loopback 00:00:00:00:00:00 brd 00:00:00:00:00:00
    inet 127.0.0.1/8 scope host lo
       valid_lft forever preferred_lft forever
    inet6 ::1/128 scope host proto kernel_lo 
       valid_lft forever preferred_lft forever
2: eth0@if9: <BROADCAST,MULTICAST,UP,LOWER_UP> mtu 1500 qdisc noqueue state UP group default 
    link/ether be:d6:a7:11:84:af brd ff:ff:ff:ff:ff:ff link-netnsid 0
    inet 10.42.42.42/24 brd 10.42.42.255 scope global eth0
       valid_lft forever preferred_lft forever
3: eth1@if22: <BROADCAST,MULTICAST,UP,LOWER_UP> mtu 1500 qdisc noqueue state UP group default 
    link/ether 7e:61:e6:75:b8:3b brd ff:ff:ff:ff:ff:ff link-netnsid 0
    inet 172.18.0.15/16 brd 172.18.255.255 scope global eth1
       valid_lft forever preferred_lft forever
4: wg0: <POINTOPOINT,NOARP,UP,LOWER_UP> mtu 1420 qdisc noqueue state UNKNOWN group default qlen 1000
    link/none 
    inet 10.8.0.1/24 scope global wg0
       valid_lft forever preferred_lft forever
```

And if the port is correctly "mapped" to the wireguard interface (**gw_priority**):
```
sudo iptables -t nat -L -n -v | grep 10.42.42.42:
```
```
    0     0 DNAT       17   --  !br-f855dff796df *       0.0.0.0/0            0.0.0.0/0            udp dpt:8080 to:10.42.42.42:8080
```

@bohleadam, you may have something wrong elsewhere...

**Comment by bohleadam** [comment]
Indeed it was. One of those situations where you spend hours looking at an issue, you step away for a few hours, come back and the solution is obvious. lol

Was completely unrelated to wg-easy

**Comment by dotvav** [comment]
Commenting so that the issue doesn't get automatically closed in 2 weeks.

I have a very similar issue, but no traefik involved. When I deploy wg-easy by following hte docker compose instructions, all works well and it is amazing. After I reboot the host machine, though, the network configuration get somehow messed up: the wg client can still perform the handshake with the server, I can ssh the host of the docker container, but any other host on the network is unreachable.

Things work again if I bring down wg-easy entirely and restart the compose procedure from scratch. Until I reboot the host.

**Comment by brmlyklr** [comment]
Adding the interface_name and wg_priority fixed the issue for me, too. Still working after a reboot.

**Comment by MystWeb** [comment]
I'm having trouble deploying wg-easy. Could you share your best practice docker-compose.yaml? Does fixing the bug require deploying Traefik?

**Comment by brmlyklr** [comment]
> I'm having trouble deploying wg-easy. Could you share your best practice docker-compose.yaml? Does fixing the bug require deploying Traefik?

This is what's working for me. I'm accessing it via Nginx Proxy Manager which is set up in a different stack, so it's also on that network:

```
volumes:
  etc_wireguard:
services:
  wg-easy:
    #environment:
    #  Optional:
    #  - PORT=51821
    #  - HOST=0.0.0.0
    #  - INSECURE=false
    image: ghcr.io/wg-easy/wg-easy:15
    container_name: wg-easy
    networks:
      wg:
        interface_name: eth0
        gw_priority: 1
        ipv4_address: 10.42.42.42
        ipv6_address: fdcc:ad94:bacf:61a3::2a
      nginx_web-network:
        interface_name: eth1
        gw_priority: 0
    volumes:
      - etc_wireguard:/etc/wireguard
      - /lib/modules:/lib/modules:ro
    ports:
      - "51820:51820/udp"
      - "51821:51821/tcp" #admin portal
    restart: unless-stopped
    cap_add:
      - NET_ADMIN
      - SYS_MODULE
      # - NET_RAW # ⚠️ Uncomment if using Podman
    sysctls:
      - net.ipv4.ip_forward=1
      - net.ipv4.conf.all.src_valid_mark=1
      - net.ipv6.conf.all.disable_ipv6=0
      - net.ipv6.conf.all.forwarding=1
      - net.ipv6.conf.default.forwarding=1

networks:
  wg:
    driver: bridge
    enable_ipv6: true
    ipam:
      driver: default
      config:
        - subnet: 10.42.42.0/24
        - subnet: fdcc:ad94:bacf:61a3::/64
  nginx_web-network:
    external: true
```

**Comment by MystWeb** [comment]
> > 我部署 wg-easy 时遇到了问题。能否分享一下您最佳实践的 docker-compose.yaml 文件？修复这个 bug 是否需要部署 Traefik？
> 
> 对我来说，这种方法有效。我通过 Nginx 代理管理器访问它，该管理器设置在另一个堆栈中，因此它也在同一个网络中：
> 
> ```
> volumes:
>   etc_wireguard:
> services:
>   wg-easy:
>     #environment:
>     #  Optional:
>     #  - PORT=51821
>     #  - HOST=0.0.0.0
>     #  - INSECURE=false
>     image: ghcr.io/wg-easy/wg-easy:15
>     container_name: wg-easy
>     networks:
>       wg:
>         interface_name: eth0
>         gw_priority: 1
>         ipv4_address: 10.42.42.42
>         ipv6_address: fdcc:ad94:bacf:61a3::2a
>       nginx_web-network:
>         interface_name: eth1
>         gw_priority: 0
>     volumes:
>       - etc_wireguard:/etc/wireguard
>       - /lib/modules:/lib/modules:ro
>     ports:
>       - "51820:51820/udp"
>       - "51821:51821/tcp" #admin portal
>     restart: unless-stopped
>     cap_add:
>       - NET_ADMIN
>       - SYS_MODULE
>       # - NET_RAW # ⚠️ Uncomment if using Podman
>     sysctls:
>       - net.ipv4.ip_forward=1
>       - net.ipv4.conf.all.src_valid_mark=1
>       - net.ipv6.conf.all.disable_ipv6=0
>       - net.ipv6.conf.all.forwarding=1
>       - net.ipv6.conf.default.forwarding=1
> 
> networks:
>   wg:
>     driver: bridge
>     enable_ipv6: true
>     ipam:
>       driver: default
>       config:
>         - subnet: 10.42.42.0/24
>         - subnet: fdcc:ad94:bacf:61a3::/64
>   nginx_web-network:
>     external: true
> ```

Thank you for sharing. This requires additional network support. Below is the Docker-compose configuration that I have successfully implemented

---------------------------------------

`
volumes:
  etc_wireguard:

services:
  wg-easy:
    environment:
     - PORT=51821
     - HOST=0.0.0.0
     - INSECURE=true # 是否允许 HTTP 访问支持（默认只允许 HTTPS）
     - DISABLE_IPV6=true # 是否禁用 IPv6 支持

    image: ghcr.io/wg-easy/wg-easy:15.2.0-beta.3
    container_name: wg-easy
    networks:
      wg:
        ipv4_address: 10.42.42.42
        ipv6_address: fdcc:ad94:bacf:61a3::2a
    volumes:
      - etc_wireguard:/etc/wireguard # 持久化配置与密钥
      - /lib/modules:/lib/modules:ro # 容器可加载内核模块，宿主机需安装 kmod-wireguard、wireguard-tools
    ports:
      - "51820:51820/udp"
      - "51821:51821/tcp"
    restart: unless-stopped
    cap_add:
      - NET_ADMIN
      - SYS_MODULE
      # - NET_RAW # ⚠️ Uncomment if using Podman
    sysctls:
      - net.ipv4.ip_forward=1
      - net.ipv4.conf.all.src_valid_mark=1
      - net.ipv6.conf.all.disable_ipv6=0
      - net.ipv6.conf.all.forwarding=1
      - net.ipv6.conf.default.forwarding=1

networks:
  wg:
    driver: bridge
    enable_ipv6: false
    ipam:
      driver: default
      config:
        - subnet: 10.42.42.0/24
        - subnet: fdcc:ad94:bacf:61a3::/64

`

[docker-compose.dev.yml](https://github.com/user-attachments/files/23981355/docker-compose.dev.yml)

**Comment by tonychen2001** [comment]
Ran into a similar issue as-well. I could establish a VPN connection but basically had no connectivity after that.

The solution given by @Cpasjuste to specify the interface names explicitly for the wg and reverse proxy (caddy in my case) networks worked for me:
```
    networks:
      wg:
        interface_name: eth0
        gw_priority: 1
        ipv4_address: 10.42.42.42
        ipv6_address: fdcc:ad94:bacf:61a3::2a
      caddy:
        interface_name: eth1
        gw_priority: 0
```

After some investigating, the root cause seemed to be a POSTROUTING MASQUERADE rule being configured on the wrong interface.

Without specifying the interface names for the networks, wg network would be set to eth1 while caddy would be set to eth0.
```
$ docker exec -it wg-easy sh -c 'ip addr'
...
2: eth0@if13: <BROADCAST,MULTICAST,UP,LOWER_UP> mtu 1500 qdisc noqueue state UP group default
    link/ether 42:57:df:f3:30:bd brd ff:ff:ff:ff:ff:ff link-netnsid 0
    inet 172.18.0.3/16 brd 172.18.255.255 scope global eth0
       valid_lft forever preferred_lft forever
3: eth1@if14: <BROADCAST,MULTICAST,UP,LOWER_UP> mtu 1500 qdisc noqueue state UP group default
    link/ether f2:ee:3e:d6:97:c3 brd ff:ff:ff:ff:ff:ff link-netnsid 0
    inet 10.42.42.42/24 brd 10.42.42.255 scope global eth1
...
```

However the POSTROUTING MASQUERADE rule seems to always be configured for eth0. So in the above situation, this rule doesn't apply to the VPN traffic.
```
$ docker exec -it wg-easy sh -c 'iptables -t nat -L POSTROUTING -v -n'
Chain POSTROUTING (policy ACCEPT 277 packets, 24446 bytes)
 pkts bytes target     prot opt in     out     source               destination
    0     0 MASQUERADE  all  --  *      eth0    10.8.0.0/24          0.0.0.0/0
```

Used tcpdump to verify that the source IP address from my VPN traffic outside the wg-easy container is indeed not being rewritten.
```
$ sudo tcpdump -i enp2s0 icmp
tcpdump: verbose output suppressed, use -v[v]... for full protocol decode
listening on enp2s0, link-type EN10MB (Ethernet), snapshot length 262144 bytes
22:16:17.899183 IP 10.8.0.2 > dns.google: ICMP echo request, id 52320, seq 0, length 64
22:16:18.896788 IP 10.8.0.2 > dns.google: ICMP echo request, id 52320, seq 1, length 64
22:16:19.903641 IP 10.8.0.2 > dns.google: ICMP echo request, id 52320, seq 2, length 64
```

Once I added the same POSTROUTING rule for eth1, my connectivity is restored (note the packet counters for the rule on eth0 vs eth1)
```
$ docker exec -it wg-easy sh -c 'iptables -t nat -A POSTROUTING -o eth1 -j MASQUERADE -s 10.8.0.0/24'
$ docker exec -it wg-easy sh -c 'iptables -t nat -L POSTROUTING -v -n'
Chain POSTROUTING (policy ACCEPT 1170 packets, 85083 bytes)
 pkts bytes target     prot opt in     out     source               destination
    0     0 MASQUERADE  all  --  *      eth0    10.8.0.0/24          0.0.0.0/0
  134 13518 MASQUERADE  all  --  *      eth1    10.8.0.0/24          0.0.0.0/0

$ sudo tcpdump -i enp2s0 icmp
tcpdump: verbose output suppressed, use -v[v]... for full protocol decode
listening on enp2s0, link-type EN10MB (Ethernet), snapshot length 262144 bytes
22:32:41.073313 IP pi.hole > dns.google: ICMP echo request, id 57188, seq 0, length 64
22:32:41.088334 IP dns.google > pi.hole: ICMP echo reply, id 57188, seq 0, length 64
22:32:42.075102 IP pi.hole > dns.google: ICMP echo request, id 57188, seq 1, length 64
```

**Comment by Delta0001** [comment]
Ran into this same issue with wg-easy + Caddy. Decided to just cut out the reverse proxy just use the VPN by itself which has been working fine.

**Comment by oregonpillow** [comment]
@Cpasjuste  @tonychen2001 Thank you both so much for documenting your solutions. This was a PITA to troubleshoot and when I saw your comments i thought "duh!" 🤦🏻. Since this won't be fixed in code, the least I could do to show my appreciation was to open a PR to add to docs, hopefully it saves someone else a headache.
