### ISSUE TITLE
[Bug]: Problem with ARP requests

### ISSUE THREAD

**Issue by DB-CL** [wg-easy/wg-easy#2310]
### Describe the bug

Hello,

My wireguard users cannot communicate with other containers.

This is my docker compose : 
```yaml
services:
  pihole:
    image: pihole/pihole:latest
    container_name: pihole
    environment:
      - TZ=Europe/Paris
      - FTLCONF_webserver_api_password=redacted
      - DNS1=unbound
    volumes:
      - ./pihole/etc-pihole:/etc/pihole/
      - ./pihole/etc-dnsmasq.d/:/etc/dnsmasq.d/
    ports:
      - "53:53/tcp"
      - "53:53/udp"
    networks:
      wg-easy:
        ipv4_address: 10.8.1.12

  wg-easy:
    image: ghcr.io/wg-easy/wg-easy:15
    container_name: wg-easy
    environment:
      - INIT_ENABLED=true
      - INIT_USERNAME=admin
      - INIT_PASSWORD=redacted
      - INIT_HOST=redacted
      - INIT_PORT=51820
      - INIT_DNS=10.8.1.12
      - INIT_IPV4_CIDR=10.8.0.0/16
      - INSECURE=true
      - PORT=51821
      - DISABLE_IPV6=true
    cap_add:
      - NET_ADMIN
      - SYS_MODULE
    sysctls:
      - net.ipv4.ip_forward=1
      - net.ipv4.conf.all.src_valid_mark=1
      - net.ipv6.conf.all.disable_ipv6=0
      - net.ipv6.conf.all.forwarding=1
      - net.ipv6.conf.default.forwarding=1
    ports:
      - "51820:51820/udp"
      - "51821:51821/tcp"
    networks:
      wg-easy:
        ipv4_address: 10.8.1.10
    
networks:
  wg-easy:
    driver: bridge
    ipam:
      driver: default
      config:
        - subnet: 10.8.0.0/16
```

When I connect a user to wireguard, this is working. The user can ping my wireguard container and I see the connection up and running in the wireguard interface.

But when I'm trying to ping my pihole, it's not working. The user does not get any response.
When I'm looking at tcpdump on the host:
```
# tcpdump -i any net 10.8.0.0/16
00:48:27.204102 veth2639f2a Out ARP, Request who-has 10.8.1.10 tell 10.8.0.1, length 28
00:48:27.204106 veth56933a2 Out ARP, Request who-has 10.8.1.10 tell 10.8.0.1, length 28
00:48:28.227135 br-49b79d6616c8 Out ARP, Request who-has 10.8.1.10 tell 10.8.0.1, length 28
00:48:28.227144 veth2639f2a Out ARP, Request who-has 10.8.1.10 tell 10.8.0.1, length 28
00:48:28.227148 veth56933a2 Out ARP, Request who-has 10.8.1.10 tell 10.8.0.1, length 28
```

I see a lot of ARP requests with no answers.

Also another strange thing, from the host, I'm unable to ping the wg-easy container. I'm pinging the pihole, but the wg-easy container is not responding. It looks like the docker network is not communicating with the wg-easy network. When I'm on the wg-easy network like with my client, I can ping the wg-easy container but not the pihole. When I'm on the host (docker network through the bridge) I can ping the pihole container but not the wg-easy container. But everything is in the same /16.

Am I missing something ?
 

### Expected behavior

I can ping the pihole container from the wg network

### Relevant log output

```shell

```

**Comment by kaaax0815** [comment]
your docker can't be the same subnet as your wireguard interface.

the default for wg easy is 10.8.0.0/24, which collides with 10.8.0.0/16
