### ISSUE TITLE
Not working under MacOS host

### ISSUE THREAD

**Issue by petr-ujezdsky** [wg-easy/wg-easy#1195]
**Describe the bug**
I am using `wg-easy` successfully inside Docker for Mac version `4.22.0`. However newer versions of Docker for Mac break the TCP layer making `wg-easy` not working at all.

> Note: To install `tcpdump` and `ethtool` inside `wg-easy` container run `apk update && apk add tcpdump ethtool`.

### client - another macbook
```
$ curl -vvv cheat.sh
<web page content>
```

```
$ ifconfig utun4
utun4: flags=8051<UP,POINTOPOINT,RUNNING,MULTICAST> mtu 1420
	options=6460<TSO4,TSO6,CHANNEL_IO,PARTIAL_CSUM,ZEROINVERT_CSUM>
	inet 10.0.4.2 --> 10.0.4.2 netmask 0xffffff00
```

```
$ sudo tcpdump -i utun4 -v | grep cheat
tcpdump: listening on utun4, link-type RAW (Raw IP), snapshot length 524288 bytes
...
    10.0.4.2.53066 > cheat.sh.http: Flags [S], cksum 0x52bf (correct), seq 3148994044, win 65535, options [mss 1380,nop,wscale 6,nop,nop,TS val 3063072233 ecr 0,sackOK,eol], length 0
    cheat.sh.http > 10.0.4.2.53066: Flags [S.], cksum 0x1fd9 (correct), seq 4170317243, ack 3148994045, win 65504, options [mss 65495,nop,nop,TS val 1634596043 ecr 3063072233,nop,wscale 5], length 0
    10.0.4.2.53066 > cheat.sh.http: Flags [.], cksum 0x3da0 (correct), ack 1, win 2052, options [nop,nop,TS val 3063072236 ecr 1634596043], length 0
    10.0.4.2.53066 > cheat.sh.http: Flags [P.], cksum 0x99f9 (correct), seq 1:72, ack 1, win 2052, options [nop,nop,TS val 3063072236 ecr 1634596043], length 71: HTTP, length: 71
    cheat.sh.http > 10.0.4.2.53066: Flags [.], cksum 0x3d5f (correct), ack 72, win 2044, options [nop,nop,TS val 1634596045 ecr 3063072236], length 0
    cheat.sh.http > 10.0.4.2.53066: Flags [.], cksum 0x29bd (correct), seq 1:1369, ack 72, win 16384, options [nop,nop,TS val 1634596122 ecr 3063072236], length 1368: HTTP, length: 1368
    cheat.sh.http > 10.0.4.2.53066: Flags [.], cksum 0xa974 (correct), seq 1369:2737, ack 72, win 16384, options [nop,nop,TS val 1634596123 ecr 3063072236], length 1368: HTTP
    10.0.4.2.53066 > cheat.sh.http: Flags [.], cksum 0x3778 (correct), ack 1369, win 2030, options [nop,nop,TS val 3063072316 ecr 1634596122], length 0
    10.0.4.2.53066 > cheat.sh.http: Flags [.], cksum 0x3234 (correct), ack 2737, win 2009, options [nop,nop,TS val 3063072316 ecr 1634596123], length 0
    cheat.sh.http > 10.0.4.2.53066: Flags [.], cksum 0x390c (correct), seq 2737:4105, ack 72, win 16384, options [nop,nop,TS val 1634596123 ecr 3063072236], length 1368: HTTP
    cheat.sh.http > 10.0.4.2.53066: Flags [.], cksum 0x5a0b (correct), seq 4105:5473, ack 72, win 16384, options [nop,nop,TS val 1634596123 ecr 3063072236], length 1368: HTTP
    10.0.4.2.53066 > cheat.sh.http: Flags [.], cksum 0x2788 (correct), ack 5473, win 2005, options [nop,nop,TS val 3063072316 ecr 1634596123], length 0
    cheat.sh.http > 10.0.4.2.53066: Flags [.], cksum 0x691b (correct), seq 5473:6841, ack 72, win 16384, options [nop,nop,TS val 1634596123 ecr 3063072236], length 1368: HTTP
    10.0.4.2.53066 > cheat.sh.http: Flags [.], cksum 0x2246 (correct), ack 6841, win 1983, options [nop,nop,TS val 3063072316 ecr 1634596123], length 0
    10.0.4.2.53066 > cheat.sh.http: Flags [.], cksum 0x2205 (correct), ack 6841, win 2048, options [nop,nop,TS val 3063072316 ecr 1634596123], length 0
    cheat.sh.http > 10.0.4.2.53066: Flags [.], cksum 0x8f40 (correct), seq 6841:8209, ack 72, win 16384, options [nop,nop,TS val 1634596123 ecr 3063072236], length 1368: HTTP
    10.0.4.2.53066 > cheat.sh.http: Flags [.], cksum 0x1cc3 (correct), ack 8209, win 2026, options [nop,nop,TS val 3063072316 ecr 1634596123], length 0
    cheat.sh.http > 10.0.4.2.53066: Flags [.], cksum 0xad47 (correct), seq 8209:9577, ack 72, win 16384, options [nop,nop,TS val 1634596123 ecr 3063072236], length 1368: HTTP
    10.0.4.2.53066 > cheat.sh.http: Flags [.], cksum 0x176b (correct), ack 9577, win 2026, options [nop,nop,TS val 3063072316 ecr 1634596123], length 0
    cheat.sh.http > 10.0.4.2.53066: Flags [.], cksum 0xc67f (correct), seq 9577:10945, ack 72, win 16384, options [nop,nop,TS val 1634596123 ecr 3063072236], length 1368: HTTP
    10.0.4.2.53066 > cheat.sh.http: Flags [.], cksum 0x1228 (correct), ack 10945, win 2005, options [nop,nop,TS val 3063072316 ecr 1634596123], length 0
    10.0.4.2.53066 > cheat.sh.http: Flags [.], cksum 0x11fd (correct), ack 10945, win 2048, options [nop,nop,TS val 3063072316 ecr 1634596123], length 0
    cheat.sh.http > 10.0.4.2.53066: Flags [.], cksum 0x3fc5 (correct), seq 10945:12313, ack 72, win 16384, options [nop,nop,TS val 1634596123 ecr 3063072236], length 1368: HTTP
    10.0.4.2.53066 > cheat.sh.http: Flags [.], cksum 0x0cba (correct), ack 12313, win 2026, options [nop,nop,TS val 3063072317 ecr 1634596123], length 0
    cheat.sh.http > 10.0.4.2.53066: Flags [.], cksum 0x6947 (correct), seq 12313:13681, ack 72, win 16384, options [nop,nop,TS val 1634596123 ecr 3063072236], length 1368: HTTP
    10.0.4.2.53066 > cheat.sh.http: Flags [.], cksum 0x0762 (correct), ack 13681, win 2026, options [nop,nop,TS val 3063072317 ecr 1634596123], length 0
    cheat.sh.http > 10.0.4.2.53066: Flags [P.], cksum 0xd6b4 (correct), seq 13681:14481, ack 72, win 16384, options [nop,nop,TS val 1634596127 ecr 3063072316], length 800: HTTP
    10.0.4.2.53066 > cheat.sh.http: Flags [.], cksum 0x0432 (correct), ack 14481, win 2035, options [nop,nop,TS val 3063072320 ecr 1634596127], length 0
    cheat.sh.http > 10.0.4.2.53066: Flags [.], cksum 0x78ad (correct), seq 14481:15849, ack 72, win 16384, options [nop,nop,TS val 1634596135 ecr 3063072320], length 1368: HTTP
    10.0.4.2.53066 > cheat.sh.http: Flags [.], cksum 0xfed3 (correct), ack 15849, win 2026, options [nop,nop,TS val 3063072327 ecr 1634596135], length 0
    cheat.sh.http > 10.0.4.2.53066: Flags [.], cksum 0xc5ab (correct), seq 15849:17217, ack 72, win 16384, options [nop,nop,TS val 1634596135 ecr 3063072320], length 1368: HTTP
    10.0.4.2.53066 > cheat.sh.http: Flags [.], cksum 0xf97b (correct), ack 17217, win 2026, options [nop,nop,TS val 3063072327 ecr 1634596135], length 0
    cheat.sh.http > 10.0.4.2.53066: Flags [.], cksum 0xacc9 (correct), seq 17217:18585, ack 72, win 16384, options [nop,nop,TS val 1634596135 ecr 3063072320], length 1368: HTTP
    10.0.4.2.53066 > cheat.sh.http: Flags [.], cksum 0xf423 (correct), ack 18585, win 2026, options [nop,nop,TS val 3063072327 ecr 1634596135], length 0
    cheat.sh.http > 10.0.4.2.53066: Flags [.], cksum 0x4b8c (correct), seq 18585:19953, ack 72, win 16384, options [nop,nop,TS val 1634596135 ecr 3063072320], length 1368: HTTP
    10.0.4.2.53066 > cheat.sh.http: Flags [.], cksum 0xeecb (correct), ack 19953, win 2026, options [nop,nop,TS val 3063072327 ecr 1634596135], length 0
    cheat.sh.http > 10.0.4.2.53066: Flags [.], cksum 0x3190 (correct), seq 19953:21321, ack 72, win 16384, options [nop,nop,TS val 1634596135 ecr 3063072320], length 1368: HTTP
    10.0.4.2.53066 > cheat.sh.http: Flags [.], cksum 0xe973 (correct), ack 21321, win 2026, options [nop,nop,TS val 3063072327 ecr 1634596135], length 0
    cheat.sh.http > 10.0.4.2.53066: Flags [.], cksum 0xd516 (correct), seq 21321:22689, ack 72, win 16384, options [nop,nop,TS val 1634596135 ecr 3063072320], length 1368: HTTP
    cheat.sh.http > 10.0.4.2.53066: Flags [.], cksum 0xc318 (correct), seq 22689:24057, ack 72, win 16384, options [nop,nop,TS val 1634596135 ecr 3063072320], length 1368: HTTP
    10.0.4.2.53066 > cheat.sh.http: Flags [.], cksum 0xe405 (correct), ack 22689, win 2048, options [nop,nop,TS val 3063072327 ecr 1634596135], length 0
    cheat.sh.http > 10.0.4.2.53066: Flags [P.], cksum 0xeb37 (correct), seq 24057:24617, ack 72, win 16384, options [nop,nop,TS val 1634596135 ecr 3063072320], length 560: HTTP
    10.0.4.2.53066 > cheat.sh.http: Flags [.], cksum 0xdc9c (correct), ack 24617, win 2017, options [nop,nop,TS val 3063072327 ecr 1634596135], length 0
    cheat.sh.http > 10.0.4.2.53066: Flags [P.], cksum 0x0630 (correct), seq 24617:25785, ack 72, win 16384, options [nop,nop,TS val 1634596139 ecr 3063072327], length 1168: HTTP
    10.0.4.2.53066 > cheat.sh.http: Flags [.], cksum 0xd7f7 (correct), ack 25785, win 2029, options [nop,nop,TS val 3063072332 ecr 1634596139], length 0
    cheat.sh.http > 10.0.4.2.53066: Flags [F.], cksum 0x9fe8 (correct), seq 25785, ack 72, win 16384, options [nop,nop,TS val 1634596139 ecr 3063072327], length 0
    10.0.4.2.53066 > cheat.sh.http: Flags [.], cksum 0xd7e3 (correct), ack 25786, win 2048, options [nop,nop,TS val 3063072332 ecr 1634596139], length 0
    10.0.4.2.53066 > cheat.sh.http: Flags [F.], cksum 0xd7e2 (correct), seq 72, ack 25786, win 2048, options [nop,nop,TS val 3063072332 ecr 1634596139], length 0
    cheat.sh.http > 10.0.4.2.53066: Flags [.], cksum 0x9fe0 (correct), ack 73, win 16383, options [nop,nop,TS val 1634596142 ecr 3063072332], length 0

```
### server - `wg-easy` container
```
# ifconfig wg0
wg0       Link encap:UNSPEC  HWaddr 00-00-00-00-00-00-00-00-00-00-00-00-00-00-00-00
          inet addr:10.0.4.1  P-t-P:10.0.4.1  Mask:255.255.255.0
          UP POINTOPOINT RUNNING NOARP  MTU:1420  Metric:1
          RX packets:166629 errors:4118 dropped:0 overruns:0 frame:4118
          TX packets:461695 errors:0 dropped:1518 overruns:0 carrier:0
          collisions:0 txqueuelen:1000
          RX bytes:65040452 (62.0 MiB)  TX bytes:535859376 (511.0 MiB)
```

```
# tcpdump -i eth0 -v | grep cheat
tcpdump: listening on eth0, link-type EN10MB (Ethernet), snapshot length 262144 bytes
...
    83957e66aad1.53066 > cheat.sh.80: Flags [S], cksum 0x51bf (correct), seq 3148994044, win 65535, options [mss 1380,nop,wscale 6,nop,nop,TS val 3063072233 ecr 0,sackOK,eol], length 0
    cheat.sh.80 > 83957e66aad1.53066: Flags [S.], cksum 0x1ed9 (correct), seq 4170317243, ack 3148994045, win 65504, options [mss 65495,nop,nop,TS val 1634596043 ecr 3063072233,nop,wscale 5], length 0
    83957e66aad1.53066 > cheat.sh.80: Flags [.], cksum 0x3ca0 (correct), ack 1, win 2052, options [nop,nop,TS val 3063072236 ecr 1634596043], length 0
    83957e66aad1.53066 > cheat.sh.80: Flags [P.], cksum 0x98f9 (correct), seq 1:72, ack 1, win 2052, options [nop,nop,TS val 3063072236 ecr 1634596043], length 71: HTTP, length: 71
    cheat.sh.80 > 83957e66aad1.53066: Flags [.], cksum 0x3c5f (correct), ack 72, win 2044, options [nop,nop,TS val 1634596045 ecr 3063072236], length 0
    cheat.sh.80 > 83957e66aad1.53066: Flags [.], cksum 0x28bd (correct), seq 1:1369, ack 72, win 16384, options [nop,nop,TS val 1634596122 ecr 3063072236], length 1368: HTTP, length: 1368
    cheat.sh.80 > 83957e66aad1.53066: Flags [.], cksum 0x3806 (incorrect -> 0x1375), seq 1369:13681, ack 72, win 16384, options [nop,nop,TS val 1634596123 ecr 3063072236], length 12312: HTTP
    83957e66aad1.53066 > cheat.sh.80: Flags [.], cksum 0x3678 (correct), ack 1369, win 2030, options [nop,nop,TS val 3063072316 ecr 1634596122], length 0
    83957e66aad1.53066 > cheat.sh.80: Flags [.], cksum 0x3134 (correct), ack 2737, win 2009, options [nop,nop,TS val 3063072316 ecr 1634596123], length 0
    83957e66aad1.53066 > cheat.sh.80: Flags [.], cksum 0x2688 (correct), ack 5473, win 2005, options [nop,nop,TS val 3063072316 ecr 1634596123], length 0
    83957e66aad1.53066 > cheat.sh.80: Flags [.], cksum 0x2146 (correct), ack 6841, win 1983, options [nop,nop,TS val 3063072316 ecr 1634596123], length 0
    83957e66aad1.53066 > cheat.sh.80: Flags [.], cksum 0x2105 (correct), ack 6841, win 2048, options [nop,nop,TS val 3063072316 ecr 1634596123], length 0
    cheat.sh.80 > 83957e66aad1.53066: Flags [P.], cksum 0xd5b4 (correct), seq 13681:14481, ack 72, win 16384, options [nop,nop,TS val 1634596127 ecr 3063072316], length 800: HTTP
    83957e66aad1.53066 > cheat.sh.80: Flags [.], cksum 0x1bc3 (correct), ack 8209, win 2026, options [nop,nop,TS val 3063072316 ecr 1634596123], length 0
    83957e66aad1.53066 > cheat.sh.80: Flags [.], cksum 0x166b (correct), ack 9577, win 2026, options [nop,nop,TS val 3063072316 ecr 1634596123], length 0
    83957e66aad1.53066 > cheat.sh.80: Flags [.], cksum 0x1128 (correct), ack 10945, win 2005, options [nop,nop,TS val 3063072316 ecr 1634596123], length 0
    83957e66aad1.53066 > cheat.sh.80: Flags [.], cksum 0x10fd (correct), ack 10945, win 2048, options [nop,nop,TS val 3063072316 ecr 1634596123], length 0
    83957e66aad1.53066 > cheat.sh.80: Flags [.], cksum 0x0bba (correct), ack 12313, win 2026, options [nop,nop,TS val 3063072317 ecr 1634596123], length 0
    83957e66aad1.53066 > cheat.sh.80: Flags [.], cksum 0x0662 (correct), ack 13681, win 2026, options [nop,nop,TS val 3063072317 ecr 1634596123], length 0
    83957e66aad1.53066 > cheat.sh.80: Flags [.], cksum 0x0332 (correct), ack 14481, win 2035, options [nop,nop,TS val 3063072320 ecr 1634596127], length 0
    cheat.sh.80 > 83957e66aad1.53066: Flags [.], cksum 0x129e (incorrect -> 0x7694), seq 14481:17217, ack 72, win 16384, options [nop,nop,TS val 1634596135 ecr 3063072320], length 2736: HTTP
    cheat.sh.80 > 83957e66aad1.53066: Flags [P.], cksum 0x24d6 (incorrect -> 0x3556), seq 17217:24617, ack 72, win 16384, options [nop,nop,TS val 1634596135 ecr 3063072320], length 7400: HTTP
    83957e66aad1.53066 > cheat.sh.80: Flags [.], cksum 0xfdd3 (correct), ack 15849, win 2026, options [nop,nop,TS val 3063072327 ecr 1634596135], length 0
    83957e66aad1.53066 > cheat.sh.80: Flags [.], cksum 0xf87b (correct), ack 17217, win 2026, options [nop,nop,TS val 3063072327 ecr 1634596135], length 0
    83957e66aad1.53066 > cheat.sh.80: Flags [.], cksum 0xf323 (correct), ack 18585, win 2026, options [nop,nop,TS val 3063072327 ecr 1634596135], length 0
    83957e66aad1.53066 > cheat.sh.80: Flags [.], cksum 0xedcb (correct), ack 19953, win 2026, options [nop,nop,TS val 3063072327 ecr 1634596135], length 0
    83957e66aad1.53066 > cheat.sh.80: Flags [.], cksum 0xe873 (correct), ack 21321, win 2026, options [nop,nop,TS val 3063072327 ecr 1634596135], length 0
    83957e66aad1.53066 > cheat.sh.80: Flags [.], cksum 0xe305 (correct), ack 22689, win 2048, options [nop,nop,TS val 3063072327 ecr 1634596135], length 0
    83957e66aad1.53066 > cheat.sh.80: Flags [.], cksum 0xdb9c (correct), ack 24617, win 2017, options [nop,nop,TS val 3063072327 ecr 1634596135], length 0
    cheat.sh.80 > 83957e66aad1.53066: Flags [P.], cksum 0x0530 (correct), seq 24617:25785, ack 72, win 16384, options [nop,nop,TS val 1634596139 ecr 3063072327], length 1168: HTTP
    cheat.sh.80 > 83957e66aad1.53066: Flags [F.], cksum 0x9ee8 (correct), seq 25785, ack 72, win 16384, options [nop,nop,TS val 1634596139 ecr 3063072327], length 0
    83957e66aad1.53066 > cheat.sh.80: Flags [.], cksum 0xd6f7 (correct), ack 25785, win 2029, options [nop,nop,TS val 3063072332 ecr 1634596139], length 0
    83957e66aad1.53066 > cheat.sh.80: Flags [.], cksum 0xd6e3 (correct), ack 25786, win 2048, options [nop,nop,TS val 3063072332 ecr 1634596139], length 0
    83957e66aad1.53066 > cheat.sh.80: Flags [F.], cksum 0xd6e2 (correct), seq 72, ack 25786, win 2048, options [nop,nop,TS val 3063072332 ecr 1634596139], length 0
    cheat.sh.80 > 83957e66aad1.53066: Flags [.], cksum 0x9ee0 (correct), ack 73, win 16383, options [nop,nop,TS val 1634596142 ecr 3063072332], length 0
```
TCP is successfully established in the beginning - `S -> S. -> .` (3-way handshake, see [documentation](https://www.tcpdump.org/manpages/tcpdump.1.html#lbAM)). Then follows the web page data.

### client - another macbook
```
$ curl -vvv cheat.sh
* Host cheat.sh:80 was resolved.
* IPv6: (none)
* IPv4: 5.9.243.188
*   Trying 5.9.243.188:80...
* connect to 5.9.243.188 port 80 from 10.0.4.2 port 55544 failed: Operation timed out
* Failed to connect to cheat.sh port 80 after 75011 ms: Couldn't connect to server
* Closing connection
curl: (28) Failed to connect to cheat.sh port 80 after 75011 ms: Couldn't connect to server
```

```
$ ifconfig utun4
utun4: flags=8051<UP,POINTOPOINT,RUNNING,MULTICAST> mtu 1420
	options=6460<TSO4,TSO6,CHANNEL_IO,PARTIAL_CSUM,ZEROINVERT_CSUM>
	inet 10.0.4.2 --> 10.0.4.2 netmask 0xffffff00
```

```
$ sudo tcpdump -i utun4 -v | grep cheat
tcpdump: listening on utun4, link-type RAW (Raw IP), snapshot length 524288 bytes
...
    10.0.4.2.52544 > cheat.sh.http: Flags [SEW], cksum 0x3e35 (correct), seq 2571259145, win 65535, options [mss 1380,nop,wscale 6,nop,nop,TS val 1537466895 ecr 0,sackOK,eol], length 0
    cheat.sh.http > 10.0.4.2.52544: Flags [S.], cksum 0xf3a9 (incorrect -> 0x43d3), seq 2401073651, ack 2571259146, win 65408, options [mss 65495,nop,nop,TS val 1650895273 ecr 1537466895,nop,wscale 7], length 0
    cheat.sh.http > 10.0.4.2.52544: Flags [S.], cksum 0xf3a9 (incorrect -> 0x43d3), seq 2401073651, ack 2571259146, win 65408, options [mss 65495,nop,nop,TS val 1650895273 ecr 1537466895,nop,wscale 7], length 0
    cheat.sh.http > 10.0.4.2.52544: Flags [S.], cksum 0xf3a9 (incorrect -> 0x43d3), seq 2401073651, ack 2571259146, win 65408, options [mss 65495,nop,nop,TS val 1650895273 ecr 1537466895,nop,wscale 7], length 0
    cheat.sh.http > 10.0.4.2.52544: Flags [S.], cksum 0xf3a9 (incorrect -> 0x43d3), seq 2401073651, ack 2571259146, win 65408, options [mss 65495,nop,nop,TS val 1650895273 ecr 1537466895,nop,wscale 7], length 0
    cheat.sh.http > 10.0.4.2.52315: Flags [S.], cksum 0xf3a9 (incorrect -> 0x09bc), seq 4203615612, ack 1431375901, win 65408, options [mss 65495,nop,nop,TS val 1650844888 ecr 4173577889,nop,wscale 7], length 0
    cheat.sh.http > 10.0.4.2.52544: Flags [S.], cksum 0xf3a9 (incorrect -> 0x43d3), seq 2401073651, ack 2571259146, win 65408, options [mss 65495,nop,nop,TS val 1650895273 ecr 1537466895,nop,wscale 7], length 0
```

### server - `wg-easy` container
```
# ifconfig wg0
wg0       Link encap:UNSPEC  HWaddr 00-00-00-00-00-00-00-00-00-00-00-00-00-00-00-00
          inet addr:10.0.4.1  P-t-P:10.0.4.1  Mask:255.255.255.0
          UP POINTOPOINT RUNNING NOARP  MTU:65455  Metric:1
          RX packets:5490 errors:1582 dropped:0 overruns:0 frame:1582
          TX packets:6953 errors:0 dropped:0 overruns:0 carrier:0
          collisions:0 txqueuelen:1000
          RX bytes:858572 (838.4 KiB)  TX bytes:1053276 (1.0 MiB)
```

```
# tcpdump -i eth0 -v | grep cheat
tcpdump: listening on eth0, link-type EN10MB (Ethernet), snapshot length 262144 bytes
...
    706a40b241c9.52544 > cheat.sh.80: Flags [SEW], cksum 0xa023 (correct), seq 2571259145, win 65535, options [mss 1380,nop,wscale 6,nop,nop,TS val 1537466895 ecr 0,sackOK,eol], length 0
    cheat.sh.80 > 706a40b241c9.52544: Flags [S.], cksum 0x5598 (incorrect -> 0xa5c1), seq 2401073651, ack 2571259146, win 65408, options [mss 65495,nop,nop,TS val 1650895273 ecr 1537466895,nop,wscale 7], length 0
    192.168.65.7.53 > 706a40b241c9.46412: 52544 1/0/0 188.243.9.5.in-addr.arpa. PTR cheat.sh. (88)
    cheat.sh.80 > 706a40b241c9.52544: Flags [S.], cksum 0x5598 (incorrect -> 0xa5c1), seq 2401073651, ack 2571259146, win 65408, options [mss 65495,nop,nop,TS val 1650895273 ecr 1537466895,nop,wscale 7], length 0
    cheat.sh.80 > 706a40b241c9.52544: Flags [S.], cksum 0x5598 (incorrect -> 0xa5c1), seq 2401073651, ack 2571259146, win 65408, options [mss 65495,nop,nop,TS val 1650895273 ecr 1537466895,nop,wscale 7], length 0
    cheat.sh.80 > 706a40b241c9.52544: Flags [S.], cksum 0x5598 (incorrect -> 0xa5c1), seq 2401073651, ack 2571259146, win 65408, options [mss 65495,nop,nop,TS val 1650895273 ecr 1537466895,nop,wscale 7], length 0
    cheat.sh.80 > 706a40b241c9.52315: Flags [S.], cksum 0x5598 (incorrect -> 0x6baa), seq 4203615612, ack 1431375901, win 65408, options [mss 65495,nop,nop,TS val 1650844888 ecr 4173577889,nop,wscale 7], length 0
    cheat.sh.80 > 706a40b241c9.52544: Flags [S.], cksum 0x5598 (incorrect -> 0xa5c1), seq 2401073651, ack 2571259146, win 65408, options [mss 65495,nop,nop,TS val 1650895273 ecr 1537466895,nop,wscale 7], length 0
    cheat.sh.80 > 706a40b241c9.52544: Flags [S.], cksum 0x5598 (incorrect -> 0xa5c1), seq 2401073651, ack 2571259146, win 65408, options [mss 65495,nop,nop,TS val 1650895273 ecr 1537466895,nop,wscale 7], length 0
```

There seems to be problem with the `S.` packet delivery to `curl` from website. `curl` then can not complete the 3-way handshake and times out after a while.
I have read that the `cksum incorrect` can be false positive due to computation offloading to NIC, but it does seem like it is the cause.

### Inspect NAT and routing
Before `tcpdump` I was looking at `iptables -vxn -L` and `iptables -vxn -L -t nat` for some routing issues. But the `tcpdump` shows that the packets are routed properly all the way to the `curl`.

### Inspect checksum computation
I have compared output of `ethtool -k wg0` and `ethtool -k eth0` from inside the `wg-easy` container for both Docker for Mac versions and they are the same.

I have tried to disable checksum on macbook client
```
$ sudo sysctl -w net.link.generic.system.hwcksum_tx=0
net.link.generic.system.hwcksum_tx: 1 -> 0

$ sudo sysctl -w net.link.generic.system.hwcksum_rx=0
net.link.generic.system.hwcksum_rx: 1 -> 0
```

### Direct communication using `nc`
I can successfully comunicate between client and `wg-easy` container using `nc`
**client**
```
$ nc -l 9999
Hello
```
**`wg-easy` container**
```
# echo Hello | nc 10.0.4.2 9999
```
Both TCP and UDP (`-u`) is working.

### Docker setting `Use kernel networking for UDP`
I have tried the switch `Resources > Network > Use kernel networking for UDP` in both ON and OFF positions (with restart).

### Client
MacBook M1
Sonoma 14.5
WireGuard app from App Store, version `1.0.16 (27)`

### Server
MacBook Intel
Sonoma 14.4.1
WireGuard app from App Store, version `1.0.16 (27)`
Docker for Mac 4.22.0 / 4.32.0

### `wg-easy` start command
```
docker run -d \
  --name=wg-easy \
  -e WG_HOST=my-host.local \
  -e WG_PORT=51820 \
  -e WG_DEFAULT_ADDRESS=10.0.4.x \
  -e WG_DEFAULT_DNS=<redacted> \
  -e PASSWORD=<redacted> \
  -v ./data:/etc/wireguard \
  -p 0.0.0.0:51820:51820/udp \
  -p 0.0.0.0:51821:51821/tcp \
  --cap-add=NET_ADMIN \
  --cap-add=SYS_MODULE \
  --sysctl="net.ipv4.conf.all.src_valid_mark=1" \
  --sysctl="net.ipv4.ip_forward=1" \
  --restart always \
  ghcr.io/wg-easy/wg-easy:13
```

### `wg0.conf`
```
# Note: Do not edit this file directly.
# Your changes will be overwritten!

# Server
[Interface]
PrivateKey = <redacted>
Address = 10.0.4.1/24
ListenPort = 51820
PreUp = 
PostUp =  iptables -t nat -A POSTROUTING -s 10.0.4.0/24 -o eth0 -j MASQUERADE; iptables -A INPUT -p udp -m udp --dport 51820 -j ACCEPT; iptables -A FORWARD -i wg0 -j ACCEPT; iptables -A FORWARD -o wg0 -j ACCEPT; 
PreDown = 
PostDown =  iptables -t nat -D POSTROUTING -s 10.0.4.0/24 -o eth0 -j MASQUERADE; iptables -D INPUT -p udp -m udp --dport 51820 -j ACCEPT; iptables -D FORWARD -i wg0 -j ACCEPT; iptables -D FORWARD -o wg0 -j ACCEPT; 


# Client: MacBook M1
[Peer]
PublicKey = <redacted>
PresharedKey = <redacted>
AllowedIPs = 10.0.4.2/32
```

### Client configuration
```
[Interface]
PrivateKey = <redacted>
Address = 10.0.4.2/24
DNS = <redacted>

[Peer]
PublicKey = <redacted>
PresharedKey = <redacted>
AllowedIPs = 0.0.0.0/0, ::/0
Endpoint = my-host.local
PersistentKeepalive = 0
```

**Comment by petr-ujezdsky** [comment]
Which part of the problem are you referring to please? As stated, in older version of Docker all worked and in the newer version all seems to work too except the packet checksums.

**Comment by pheiduck** [comment]
I have this versions: nightly image is working fine.
```
$ docker --version        
Docker version 26.1.0, build 9714adc6c7
$ docker-compose --version
Docker Compose version 2.27.0
```

**Comment by petr-ujezdsky** [comment]
Yeah, I have opened similar ticket upstream in `docker-for-mac` - https://github.com/docker/for-mac/issues/7360.
I will leave this ticket opened here for people who might be affected, because if you try `wg-easy` in the most recent version of Docker for Mac on macOS it simply does not work.
